activity,male_rural,female_rural,person_rural,male_urban,female_urban,person_urban,male_all,female_all,person_all
Employment and related activities,434,317,404,514,375,485,459,333,429
Production of goods for own final use,203,123,158,134,64,85,198,116,151
Unpaid domestic services for household members,98,301,249,94,293,247,97,299,248
Unpaid caregiving services for household members,77,132,113,75,138,116,76,134,114
"Unpaid volunteer, trainee and other unpaid work",99,98,98,111,101,106,102,99,101
Learning,422,422,422,435,425,430,426,423,424
"Socializing and communication, community participation and religious practice",151,139,145,138,138,138,147,139,143
"Culture, leisure, mass-media and sports practices",162,157,159,171,181,176,164,165,165
Self-care and maintenance,737,724,731,711,720,715,729,723,726